{
  "$schema": "https://json-schema.org/draft/2020-12/schema",
  "$id": "urn:pxapi:schema:analysis-run-state:1.0.0",
  "title": "PXAPI analysis run state v1",
  "description": "The current state of one Analysis Run (Confluence 39846055 §16; 40239107 §6 persists state and transitions). The top-level state vocabulary is exactly the nineteen canonical states; failure categories stay coarse, and the failure block names the stage that failed so a caller knows which activity failed without any additional top-level state. BLOCKED_INPUT is the one failure that happens before any stage runs and therefore has no stage. Which transitions are legal is decided by pxapi.domain.run_state, not by this document.",
  "type": "object",
  "properties": {
    "schema_version": {
      "$ref": "urn:pxapi:schema:common:1.0.0#/$defs/schema_version",
      "description": "Required. Always 1.0.0 for this contract."
    },
    "run_id": {
      "$ref": "urn:pxapi:schema:common:1.0.0#/$defs/id",
      "description": "Required. The Analysis Run this state belongs to."
    },
    "state": {
      "$ref": "urn:pxapi:schema:common:1.0.0#/$defs/run_state",
      "description": "Required. The run's current top-level state."
    },
    "entered_at": {
      "$ref": "urn:pxapi:schema:common:1.0.0#/$defs/timestamp",
      "description": "Required. When the current state was entered."
    },
    "transitions": {
      "type": "array",
      "minItems": 1,
      "prefixItems": [{ "$ref": "#/$defs/entry_transition" }],
      "items": { "$ref": "#/$defs/transition" },
      "description": "Required. The ordered audit log of state changes. The first entry is always the entry into REQUESTED (from nothing); every later entry names the state it left. Never empty: a run that exists has been requested. Repeated READY -> DELIVERY_FAILED -> READY entries are legal; v1 derives no attempt count from them."
    },
    "stage_executions": {
      "type": "array",
      "items": { "$ref": "urn:pxapi:schema:stage-execution-record:1.0.0" },
      "uniqueItems": true,
      "description": "Required. The stage execution records that exist for this run — one per stage that has started, embedded in full. An empty array means no stage has started yet; stages that have not started are not pre-materialised."
    },
    "failure": {
      "type": "object",
      "properties": {
        "failure_stage": {
          "anyOf": [
            { "$ref": "urn:pxapi:schema:common:1.0.0#/$defs/stage" },
            { "type": "null" }
          ],
          "description": "Required, nullable. The stage whose failure produced the current failure state; null if and only if state is BLOCKED_INPUT, which happens before any stage runs. For every other failure state it must be a stage that maps to that state (e.g. FAILED_COLLECTION from BASELINE_COLLECTION or TARGETED_COLLECTION)."
        },
        "code": {
          "$ref": "urn:pxapi:schema:common:1.0.0#/$defs/code",
          "description": "Required. A stable, client-readable failure code."
        },
        "occurred_at": {
          "$ref": "urn:pxapi:schema:common:1.0.0#/$defs/timestamp",
          "description": "Required. When the failure occurred."
        }
      },
      "required": ["failure_stage", "code", "occurred_at"],
      "additionalProperties": false,
      "description": "Conditional. Present if and only if state is one of the six failure states."
    }
  },
  "required": ["schema_version", "run_id", "state", "entered_at", "transitions", "stage_executions"],
  "additionalProperties": false,
  "allOf": [
    {
      "if": {
        "properties": {
          "state": {
            "enum": [
              "BLOCKED_INPUT",
              "FAILED_COLLECTION",
              "FAILED_RESEARCH",
              "FAILED_SYNTHESIS",
              "FAILED_VALIDATION",
              "DELIVERY_FAILED"
            ]
          }
        },
        "required": ["state"]
      },
      "then": { "required": ["failure"] },
      "else": { "not": { "required": ["failure"] } }
    },
    {
      "if": {
        "properties": { "state": { "const": "BLOCKED_INPUT" } },
        "required": ["state"]
      },
      "then": {
        "properties": {
          "failure": { "properties": { "failure_stage": { "type": "null" } } }
        }
      }
    },
    {
      "if": {
        "properties": { "state": { "const": "FAILED_COLLECTION" } },
        "required": ["state"]
      },
      "then": {
        "properties": {
          "failure": {
            "properties": {
              "failure_stage": { "enum": ["BASELINE_COLLECTION", "TARGETED_COLLECTION"] }
            }
          }
        }
      }
    },
    {
      "if": {
        "properties": { "state": { "const": "FAILED_RESEARCH" } },
        "required": ["state"]
      },
      "then": {
        "properties": {
          "failure": { "properties": { "failure_stage": { "enum": ["BUSINESS_RESEARCH"] } } }
        }
      }
    },
    {
      "if": {
        "properties": { "state": { "const": "FAILED_SYNTHESIS" } },
        "required": ["state"]
      },
      "then": {
        "properties": {
          "failure": {
            "properties": {
              "failure_stage": {
                "enum": ["SYNTHESIS", "SCORING", "PRODUCT_DIAGNOSIS", "CUSTOMER_PROJECTION"]
              }
            }
          }
        }
      }
    },
    {
      "if": {
        "properties": { "state": { "const": "FAILED_VALIDATION" } },
        "required": ["state"]
      },
      "then": {
        "properties": {
          "failure": {
            "properties": { "failure_stage": { "enum": ["RENDERING", "VALIDATION"] } }
          }
        }
      }
    },
    {
      "if": {
        "properties": { "state": { "const": "DELIVERY_FAILED" } },
        "required": ["state"]
      },
      "then": {
        "properties": {
          "failure": { "properties": { "failure_stage": { "enum": ["DELIVERY"] } } }
        }
      }
    }
  ],
  "$defs": {
    "entry_transition": {
      "type": "object",
      "properties": {
        "from_state": {
          "type": "null",
          "description": "Required, nullable. Always null: the first transition enters REQUESTED from nothing."
        },
        "to_state": {
          "type": "string",
          "const": "REQUESTED",
          "description": "Required. Always REQUESTED: every run begins there."
        },
        "at": {
          "$ref": "urn:pxapi:schema:common:1.0.0#/$defs/timestamp",
          "description": "Required. When the run was requested."
        }
      },
      "required": ["from_state", "to_state", "at"],
      "additionalProperties": false,
      "description": "The first entry of the transition log."
    },
    "transition": {
      "type": "object",
      "properties": {
        "from_state": {
          "$ref": "urn:pxapi:schema:common:1.0.0#/$defs/run_state",
          "description": "Required. The state the run left."
        },
        "to_state": {
          "$ref": "urn:pxapi:schema:common:1.0.0#/$defs/run_state",
          "description": "Required. The state the run entered."
        },
        "at": {
          "$ref": "urn:pxapi:schema:common:1.0.0#/$defs/timestamp",
          "description": "Required. When the transition happened."
        }
      },
      "required": ["from_state", "to_state", "at"],
      "additionalProperties": false,
      "description": "Every entry of the transition log after the first."
    }
  }
}
