{
  "schema_version": "1.0.0",
  "run_id": "run_01J6ZK3M8Q0X4V9R2T7B5N1C6E",
  "state": "BLOCKED_INPUT",
  "entered_at": "2026-09-02T11:02:05Z",
  "transitions": [
    { "from_state": null, "to_state": "REQUESTED", "at": "2026-09-02T11:02:00Z" },
    { "from_state": "REQUESTED", "to_state": "BLOCKED_INPUT", "at": "2026-09-02T11:02:05Z" }
  ],
  "stage_executions": [],
  "failure": {
    "failure_stage": null,
    "code": "REQUEST_NOT_ELIGIBLE",
    "occurred_at": "2026-09-02T11:02:05Z"
  }
}
