{
  "schema_version": "1.0.0",
  "run_id": "run_01J6ZK3M8Q0X4V9R2T7B5N1C6D",
  "state": "COLLECTING_BASELINE",
  "entered_at": "2026-09-02T10:15:00Z",
  "transitions": [
    { "from_state": null, "to_state": "REQUESTED", "at": "2026-09-02T10:14:30Z" },
    { "from_state": "REQUESTED", "to_state": "VERIFIED", "at": "2026-09-02T10:14:45Z" },
    { "from_state": "VERIFIED", "to_state": "COLLECTING_BASELINE", "at": "2026-09-02T10:15:00Z" }
  ],
  "stage_executions": [
    {
      "schema_version": "1.0.0",
      "run_id": "run_01J6ZK3M8Q0X4V9R2T7B5N1C6D",
      "stage": "BASELINE_COLLECTION",
      "status": "RUNNING",
      "started_at": "2026-09-02T10:15:00Z",
      "finished_at": null,
      "output_artifact_refs": []
    },
    {
      "schema_version": "1.0.0",
      "run_id": "run_01J6ZK3M8Q0X4V9R2T7B5N1C6D",
      "stage": "BUSINESS_RESEARCH",
      "status": "SUCCEEDED",
      "started_at": "2026-09-02T10:15:00Z",
      "finished_at": "2026-09-02T10:16:10Z",
      "output_artifact_refs": [
        { "artifact_id": "art_business_context_0001", "artifact_type": "business-context" },
        { "artifact_id": "art_business_intent_set_0001", "artifact_type": "business-intent-set" }
      ]
    }
  ]
}
